{
  "schema_version": "3.0",
  "sync": {
    "mode": "nearest",
    "n_matched": 309,
    "n_total": 310,
    "n_dropped": 1,
    "gap_quantiles_ms": {
      "median": 0.038623809814453125,
      "p95": 7.568168640136716,
      "p99": 8.545770645141603
    },
    "risk_threshold": 0.3,
    "risk_n": 309,
    "risk_excess_count": 101,
    "risk_quantiles": {
      "median": 0.05588394145429371,
      "p95": 7.799125952174818,
      "p99": 8.437851996276411
    }
  },
  "alignment": {
    "declared_gauge": "se3",
    "mode": "se3",
    "dof_removed": 6,
    "scale": 1.0,
    "translation": [
      -27.919881514333646,
      24.983193400568442,
      5.657320501531848
    ],
    "rotation_matrix": [
      [
        0.7577069150476645,
        -0.6296802879005885,
        0.17141460240709647
      ],
      [
        0.65134221244711,
        0.7459656247406312,
        -0.1388834367007942
      ],
      [
        -0.04041723856789738,
        0.21688250675135634,
        0.9753606641093299
      ]
    ],
    "residual_quantiles": {
      "p50": 0.012631547620422654,
      "p95": 0.02944778128495251
    },
    "trajectory_length_m": 31.978294994730874
  },
  "ensemble": null,
  "scores": {
    "translation_crps": {
      "n": 309,
      "mean": 0.006465775029662079,
      "median": 0.00582846457678748,
      "std": 0.003965766914389919,
      "min": 0.0003050710562983669,
      "max": 0.0199176550550875,
      "ci_low": 0.004736734110118694,
      "ci_high": 0.008441690037251112,
      "ci_level": 0.95,
      "block_length": 24.673923078340426
    },
    "energy_score": {
      "n": 309,
      "mean": 0.012530462025323999,
      "median": 0.011786610903523691,
      "std": 0.007140252374777453,
      "min": 0.0006262220495590752,
      "max": 0.038109027798820236,
      "ci_low": 0.009212636567173029,
      "ci_high": 0.016042249169787016,
      "ci_level": 0.95,
      "block_length": 24.750396258189276
    },
    "log_score_translation": {
      "n": 309,
      "mean": 184.46873624905618,
      "median": 102.58307416888907,
      "std": 288.3543130909145,
      "min": -18.11669684505193,
      "max": 1569.9916472442033,
      "ci_low": 78.91953735125747,
      "ci_high": 317.4920296940016,
      "ci_level": 0.95,
      "block_length": 23.468600242644506
    },
    "interval_score": {
      "n": 309,
      "mean": 0.2241670186429248,
      "median": 0.21148386813208572,
      "std": 0.1433010269589185,
      "min": 0.0013387671780086135,
      "max": 0.7243619148662219,
      "ci_low": 0.15795717631154418,
      "ci_high": 0.2915245839068146,
      "ci_level": 0.95,
      "block_length": 24.791671495353285
    }
  },
  "calibration": {
    "coverage": 0.006472491909385114,
    "nominal_coverage": 0.9,
    "n_coverage": 309,
    "coverage_p": 3.8572479999997366e-303,
    "z_translation_mean": 9.865826708648965,
    "z_translation_std": 6.183646073159212
  },
  "calibration_split": null,
  "bias_variance": null,
  "recommendations": [
    "32.7% of pairs have sync risk > 0.3; consider cross-checking with --sync=interpolate_ref to confirm calibration findings.",
    "6 DoF removed over 32 m of trajectory; post-alignment residuals are biased low. Consider --n_to_align to fit on a prefix and score on the remainder.",
    "Coverage significantly below nominal (binomial p < 0.05) \u2014 the filter is over-confident (claimed \u03a3 too tight, reference falls outside the predicted intervals); widen process noise. Miscalibration is unlikely to be explained by sync error alone."
  ],
  "diagnoses": [
    {
      "mode": "sync_risk",
      "severity": "warning",
      "signals_triggered": [
        "32.7% of pairs exceed sync risk 0.3"
      ],
      "explanation": "A competing confounder: timestamp-matching error shrinks short-window \u03a3_rel the same way local over-confidence does.",
      "recommended_actions": [
        "Re-score with --sync=interpolate_ref to separate sync from a genuine calibration fault before trusting short-horizon verdicts."
      ]
    }
  ]
}
