{
  "schema_version": "3.0",
  "sync": {
    "mode": "nearest",
    "n_matched": 6,
    "n_total": 6,
    "n_dropped": 0,
    "gap_quantiles_ms": {
      "median": 0.0,
      "p95": 0.0,
      "p99": 0.0
    },
    "risk_threshold": 0.3,
    "risk_n": 0,
    "risk_excess_count": 0,
    "risk_quantiles": null
  },
  "alignment": {
    "declared_gauge": "fixed",
    "mode": "none",
    "dof_removed": 0,
    "scale": 1.0,
    "translation": [
      0.0,
      0.0,
      0.0
    ],
    "rotation_matrix": [
      [
        1.0,
        0.0,
        0.0
      ],
      [
        0.0,
        1.0,
        0.0
      ],
      [
        0.0,
        0.0,
        1.0
      ]
    ],
    "residual_quantiles": {
      "p50": 0.02,
      "p95": 0.0375
    },
    "trajectory_length_m": 5.0
  },
  "ensemble": null,
  "scores": {
    "translation_crps": {
      "n": 6,
      "mean": 0.00722222222222,
      "median": 0.00666666666667,
      "std": 0.00389681731483,
      "min": 0.00333333333333,
      "max": 0.0133333333333,
      "ci_low": 0.00444444444444,
      "ci_high": 0.0105555555556,
      "ci_level": 0.95,
      "block_length": 1.0
    },
    "energy_score": {
      "n": 6,
      "mean": 0.0216666666667,
      "median": 0.02,
      "std": 0.0116904519445,
      "min": 0.01,
      "max": 0.04,
      "ci_low": 0.0133333333333,
      "ci_high": 0.03,
      "ci_level": 0.95,
      "block_length": 1.0
    }
  },
  "calibration": {},
  "calibration_split": null,
  "bias_variance": null,
  "recommendations": [],
  "diagnoses": []
}
